<xs:schema elementFormDefault="qualified" xmlns:xs="http://www.w3.org/2001/XMLSchema">
    <xs:element name="szkola">
        <xs:complexType>
            <xs:sequence>
                <xs:element name="nauczyciele">
                    <xs:complexType>
                        <xs:sequence>
                           <xs:element ref="osoba" />
                        </xs:sequence>
                    </xs:complexType>
                </xs:element>
                <xs:element name="uczniowie">
                    <xs:complexType>
                        <xs:sequence>
                            <xs:element ref="osoba" />
                        </xs:sequence>
                    </xs:complexType>
                </xs:element>
                <xs:element name="pozostali">
                    <xs:complexType>
                        <xs:sequence>
                            <xs:element ref="osoba" />
                        </xs:sequence>
                    </xs:complexType>
                </xs:element>
            </xs:sequence>
        </xs:complexType>
    </xs:element>

    <xs:element name="osoba">
        <xs:complexType>
            <xs:sequence>
                <xs:element type="xs:string" name="imie"/>
                <xs:element type="xs:string" name="nazwisko"/>
            </xs:sequence>
            <xs:attribute type="xs:string" name="plec"/>
        </xs:complexType>
    </xs:element>
</xs:schema>

